Enter password: ***********
Welcome to the MySQL monitor.  Commands end with ; or \g.
Your MySQL connection id is 23
Server version: 8.0.36 MySQL Community Server - GPL

Copyright (c) 2000, 2024, Oracle and/or its affiliates.

Oracle is a registered trademark of Oracle Corporation and/or its
affiliates. Other names may be trademarks of their respective
owners.

Type 'help;' or '\h' for help. Type '\c' to clear the current input statement.

mysql> create database fantasmas;
Query OK, 1 row affected (0.93 sec)

mysql> use fantasmas;
Database changed
mysql> create table integrantes(
    -> id INT PRIMARY KEY NOT NULL,
    -> nombre VARCHAR(20) NOT NULL,
    -> edad INT NOT NULL);
Query OK, 0 rows affected (0.73 sec)

mysql> show tables;
+---------------------+
| Tables_in_fantasmas |
+---------------------+
| integrantes         |
+---------------------+
1 row in set (0.00 sec)

mysql> INSERT INTO integrantes (id, nombre, edad) value (1, 'Daniel', 24);
Query OK, 1 row affected (0.56 sec)

mysql> INSERT INTO integrantes (id, nombre, edad) value (2, 'Axel', 22);
Query OK, 1 row affected (0.02 sec)

mysql> INSERT INTO integrantes (id, nombre, edad) value (3, 'Almir', 18);
Query OK, 1 row affected (0.02 sec)

mysql> select * from integrantes;
+----+--------+------+
| id | nombre | edad |
+----+--------+------+
|  1 | Daniel |   24 |
|  2 | Axel   |   22 |
|  3 | Almir  |   18 |
+----+--------+------+
3 rows in set (0.00 sec)

mysql> REPLACE INTO integrantes (id, nombre, edad) VALUES (3, 'Yoav', 21);
Query OK, 2 rows affected (0.90 sec)

mysql> select * from integrantes;
+----+--------+------+
| id | nombre | edad |
+----+--------+------+
|  1 | Daniel |   24 |
|  2 | Axel   |   22 |
|  3 | Yoav   |   21 |
+----+--------+------+
3 rows in set (0.00 sec)

mysql> UPDATE integrantes SET edad = '20';
Query OK, 3 rows affected (0.48 sec)
Rows matched: 3  Changed: 3  Warnings: 0

mysql> select * from integrantes;
+----+--------+------+
| id | nombre | edad |
+----+--------+------+
|  1 | Daniel |   20 |
|  2 | Axel   |   20 |
|  3 | Yoav   |   20 |
+----+--------+------+
3 rows in set (0.00 sec)

mysql> UPDATE integrantes SET edad = '19' WHERE id = '1';
Query OK, 1 row affected (0.53 sec)
Rows matched: 1  Changed: 1  Warnings: 0

mysql> select * from integrantes;
+----+--------+------+
| id | nombre | edad |
+----+--------+------+
|  1 | Daniel |   19 |
|  2 | Axel   |   20 |
|  3 | Yoav   |   20 |
+----+--------+------+
3 rows in set (0.00 sec)